{"allowed_evidence":[{"collector_id":"fixture-collector-005","evidence_id":"fixture-evidence-005","max_age_seconds":86400,"tool":{"executable_digest":"2cbcb6969f4715817f33a2b4c8eb078640e3313a53a007d10289581ade016c51","name":"fixture-native-adapter","version":"1"}}],"applicable_scopes":[{"id":"component-005","kind":"component","purpose":"fixture verification"}],"assurance_domain":"fixture_contract","authority_source":{"kind":"fixture_contract","source_ref":"tests/fixtures/assurance/fixture-trust/README.md"},"digest":"1f8332dbc6af22e65fc57fb6dce9baf04fa556fe7963aabc186c3e5ef77c37b6","expected_set_rule":{"artifact_obligations":"all","plan_instances":"all"},"freshness_rules":{"max_age_seconds":86400,"no_impact":{"allowed_paths":["/as_of","/policy/digest","/policy/predicates/0/subject_ref","/policy/predicates/1/subject_ref","/policy/predicates/2/subject_ref","/subject/artifact_candidate/bindings/request","/subject/artifact_candidate/candidate_identity","/subject/artifact_candidate/digest","/subject/artifact_candidate/index_digest","/subject/artifact_candidate/native_receipt_digest","/subject/digest","/subject/file_closure/1/sha256"],"authority_ref":"fixture-authority-005","role":"component_reviewer"}},"id":"fixture-gate-policy-005","independence_rules":["independent_from_author"],"kind":"assurance_gate_policy","limits":{"decisions":10000,"evidence":100000,"predicates":100000},"not_applicable_rules":{"whole_gate":false},"outcome_routes":{"blocked":"obtain_evidence","fail":"repair","not_applicable":"record_tailoring","not_evaluated":"evaluate","pass":"review_complete","stale":"reassess"},"predicates":[{"acceptable_result":"pass","applicability":"required","authority_ref":"fixture-gate-policy-005","evidence_id":"fixture-evidence-005","gate_id":"component-verification","obligation_id":"obligation-a","policy_rule_ref":"fixture-measurement-a","predicate_class":"trusted_evidence","predicate_id":"fixture-measurement-a","required":true,"scope":{"id":"component-005","kind":"component","purpose":"fixture verification"},"source_ref":"fixture-plan","subject_ref":"c8d8c89e388b3872263a7a7ddabe34fa612617eeddd3e58b5a5ea406b7a399e8"},{"acceptable_result":"pass","applicability":"required","authority_ref":"fixture-gate-policy-005","check":"candidate_valid","gate_id":"component-verification","obligation_id":"obligation-b","policy_rule_ref":"fixture-candidate-b","predicate_class":"deterministic_check","predicate_id":"fixture-candidate-b","required":true,"scope":{"id":"component-005","kind":"component","purpose":"fixture verification"},"source_ref":"fixture-candidate","subject_ref":"c8d8c89e388b3872263a7a7ddabe34fa612617eeddd3e58b5a5ea406b7a399e8"},{"acceptable_result":"approve","applicability":"required","authority_ref":"fixture-gate-policy-005","gate_id":"component-verification","obligation_id":"obligation-b","policy_rule_ref":"fixture-review","predicate_class":"human_decision","predicate_id":"fixture-review","required":true,"role":"component_reviewer","scope":{"id":"component-005","kind":"component","purpose":"fixture verification"},"source_ref":"fixture-policy","subject_ref":"c8d8c89e388b3872263a7a7ddabe34fa612617eeddd3e58b5a5ea406b7a399e8"}],"required_roles":["component_reviewer"],"schema_version":1,"status":"fixture_only","subject_requirements":{"trace_required":false}}
